{
 "schema_version": "1.0",
 "title": "M7-F/1372 — La fucina grande, livello −3 (Giorno 3 dell'assedio)",
 "tipo": "tattica",
 "ambiente": "interni",
 "scale_m_per_square": 1.5,
 "map_size": [
  30,
  22
 ],
 "base_terrain": "🏰",
 "north": "N",
 "regions": [
  {
   "terrain": "⬜",
   "rect": [
    3,
    3,
    24,
    16
   ],
   "label": "La fucina grande (36 × 24 m, volta a 18 m)"
  },
  {
   "terrain": "⬜",
   "rect": [
    13,
    1,
    3,
    2
   ],
   "label": "Scala dalle gallerie di Zeth"
  },
  {
   "terrain": "⬜",
   "rect": [
    27,
    10,
    3,
    2
   ],
   "label": "Passaggio verso il basso"
  }
 ],
 "structures": [
  {
   "type": "🔼",
   "at": [
    14,
    1
   ],
   "label": "Scala alle gallerie (livello −2)",
   "collega": "M7-E-gallerie-1372.md AA22"
  },
  {
   "type": "🚪",
   "at": [
    27,
    10
   ],
   "label": "Verso le miniere profonde"
  },
  {
   "type": "🚪",
   "at": [
    27,
    11
   ]
  },
  {
   "type": "🟪",
   "at": [
    7,
    7
   ],
   "label": "Pilastro"
  },
  {
   "type": "🟪",
   "at": [
    7,
    14
   ]
  },
  {
   "type": "🟪",
   "at": [
    11,
    7
   ]
  },
  {
   "type": "🟪",
   "at": [
    11,
    14
   ]
  },
  {
   "type": "🟪",
   "at": [
    18,
    7
   ]
  },
  {
   "type": "🟪",
   "at": [
    18,
    14
   ]
  },
  {
   "type": "🟪",
   "at": [
    22,
    7
   ]
  },
  {
   "type": "🟪",
   "at": [
    22,
    14
   ]
  },
  {
   "type": "🏮",
   "at": [
    5,
    3
   ],
   "label": "Forgia"
  },
  {
   "type": "🏮",
   "at": [
    5,
    18
   ]
  },
  {
   "type": "🏮",
   "at": [
    9,
    3
   ]
  },
  {
   "type": "🏮",
   "at": [
    9,
    18
   ]
  },
  {
   "type": "🏮",
   "at": [
    13,
    3
   ]
  },
  {
   "type": "🏮",
   "at": [
    13,
    18
   ]
  },
  {
   "type": "🏮",
   "at": [
    17,
    3
   ]
  },
  {
   "type": "🏮",
   "at": [
    17,
    18
   ]
  },
  {
   "type": "🏮",
   "at": [
    21,
    3
   ]
  },
  {
   "type": "🏮",
   "at": [
    21,
    18
   ]
  },
  {
   "type": "🏮",
   "at": [
    25,
    3
   ]
  },
  {
   "type": "🏮",
   "at": [
    25,
    18
   ]
  },
  {
   "type": "🛢",
   "at": [
    4,
    10
   ],
   "label": "Vasche per temprare"
  },
  {
   "type": "🛢",
   "at": [
    4,
    11
   ]
  },
  {
   "type": "🪑",
   "at": [
    14,
    10
   ],
   "label": "Banchi e incudini"
  },
  {
   "type": "🪑",
   "at": [
    15,
    10
   ]
  },
  {
   "type": "🪑",
   "at": [
    14,
    11
   ]
  },
  {
   "type": "🪑",
   "at": [
    15,
    11
   ]
  },
  {
   "type": "🧱",
   "line": [
    [
     8,
     9
    ],
    [
     8,
     12
    ]
   ],
   "label": "Muro di scudi della retroguardia"
  },
  {
   "type": "🧱",
   "line": [
    [
     21,
     9
    ],
    [
     21,
     12
    ]
   ]
  }
 ],
 "units": [
  {
   "faction": "Hammerfist",
   "name": "Retroguardia: gli ultimi a scendere al Cuore",
   "token": "🔵",
   "area": {
    "rect": [
     9,
     9,
     2,
     4
    ]
   },
   "quantity": 12
  },
  {
   "faction": "Orda",
   "name": "Orchi dalla scala delle gallerie",
   "token": "🔴",
   "area": {
    "rect": [
     12,
     4,
     5,
     2
    ]
   },
   "quantity": 15,
   "cr": "GS ½"
  }
 ],
 "movements": [
  {
   "name": "Ritirata verso il Cuore della Montagna",
   "path": [
    [
     14,
     1
    ],
    [
     14,
     6
    ],
    [
     24,
     10
    ],
    [
     29,
     10
    ]
   ],
   "color": "#2c8c3c"
  },
  {
   "name": "Riconquista: dal Cuore verso le gallerie",
   "path": [
    [
     29,
     11
    ],
    [
     20,
     11
    ],
    [
     14,
     6
    ],
    [
     14,
     1
    ]
   ],
   "color": "#1d6fd8"
  }
 ],
 "notes": [
  "D48 (DM, 2026-10-08): nel 1372 la fucina grande è l'ultima sala prima della discesa al Cuore della Montagna: le forge sono spente da generazioni, i pilastri reggono ancora."
 ]
}
